{
    "id": "amd-ryzen-9700x",
    "specifications": {
        "cores": {
            "total": 8,
            "performance": 8,
            "efficient": null,
            "threads": 16
        },
        "clocks": {
            "performance": {
                "base": 3.8,
                "boost": 5.5
            }
        },
        "cache": {
            "l2": 8,
            "l3": 32
        },
        "integratedGraphics": {
            "model": "AMD Radeon Graphics"
        },
        "memory": {
            "max": 192,
            "types": ["DDR5"]
        },
        "multithreading": true,
        "pcieSupport": {
            "version": [5],
            "lanes": 28,
            "usable": 24
        },
        "lithography": "4nm"
    },
    "metadata": {
        "name": "AMD Ryzen 7 9700X",
        "manufacturer": "AMD",
        "ecc": {
            "support": true,
            "needMotherboard": true
        },
        "tdp": {
            "base": 65,
            "max": 140
        },
        "microarchitecture": "Zen 5",
        "socket": "AM5"
    },
    "links": {
        "productPage": "https://www.amd.com/en/products/processors/desktops/ryzen/9000-series/amd-ryzen-7-9700x.html",
        "sellers": [
            {
                "name": "Amazon",
                "url": "https://www.amazon.com/AMD-9700X-16-Thread-Unlocked-Processor/dp/B0D6NMDNNX?crid=37H6K5U42YAJM&dib=eyJ2IjoiMSJ9.jHec92YV0x_7qBlaVJqsRdefHhkShaNKgdrUQ5TpOxDol3yMZu8ksualxx2Af5WnB9-QxsitEJpyRSKX0c8rwg4DbklL39JDqupoZi5TGkWR_7qcJDgu5c0DthUjrVsRbXVa9-d92z7-FdSMH1ixiOuZugQQJsu_RzPBCi42rhVUcrSowy6VIq6haDnUxjo-GJCuWOOZFxvu8cvSqw1Zsbl42St2w27gcoc9TODqmTw.nAr9V-GE_zBq3YrftgZxykYr96lV_jOT6ILXjedQUB8&dib_tag=se&keywords=amd+9700x&qid=1768190688&sprefix=amd+900x%2Caps%2C284&sr=8-1&linkCode=ll1&tag=3dpc043-20&linkId=5ae44f48c596e5de52521167905721d5&language=en_US&ref_=as_li_ss_tl"
         }
        ],
        "images": {
        }
    }
}