{
    "id": "amd-ryzen-9950x",
    "specifications": {
        "cores": {
            "total": 16,
            "performance": 16,
            "efficient": null,
            "threads": 32
        },
        "clocks": {
            "performance": {
                "base": 4.3,
                "boost": 5.7
            }
        },
        "cache": {
            "l2": 16,
            "l3": 64
        },
        "integratedGraphics": {
            "model": "AMD Radeon Graphics"
        },
        "memory": {
            "max": 192,
            "types": ["DDR5"]
        },
        "multithreading": true,
        "pcieSupport": {
            "version": [5],
            "lanes": 28,
            "usable": 24
        },
        "lithography": "4nm"
    },
    "metadata": {
        "name": "AMD Ryzen 9 9950X",
        "manufacturer": "AMD",
        "ecc": {
            "support": true,
            "needMotherboard": true
        },
        "tdp": {
            "base": 170,
            "max": 230
        },
        "microarchitecture": "Zen 5",
        "socket": "AM5"
    },
    "links": {
        "productPage": "https://www.amd.com/en/products/processors/desktops/ryzen/9000-series/amd-ryzen-9-9950x.html",
        "sellers": [
            {
                "name": "Amazon",
                "url": "https://www.amazon.com/AMD-Ryzen-9950X3D-16-Core-Processor/dp/B0DVZSG8D5?_encoding=UTF8&pd_rd_w=KhTbG&content-id=amzn1.sym.4efc43db-939e-4a80-abaf-50c6a6b8c631%3Aamzn1.symc.5a16118f-86f0-44cd-8e3e-6c5f82df43d0&pf_rd_p=4efc43db-939e-4a80-abaf-50c6a6b8c631&pf_rd_r=RV6DW2AZBH97GEEWN0F3&pd_rd_wg=jmBo3&pd_rd_r=60319018-ac5c-49ca-80dd-420c8bf99ed2&linkCode=ll1&tag=3dpc043-20&linkId=40dc9a6393796a644a9d67a56c148ed0&language=en_US&ref_=as_li_ss_tl"
         }
        ],
        "images": {
        }
    }
}