{
    "id": "amd-ryzen-9600",
    "specifications": {
        "cores": {
            "total": 6,
            "performance": 6,
            "efficient": null,
            "threads": 12
        },
        "clocks": {
            "performance": {
                "base": 3.8,
                "boost": 5.2
            }
        },
        "cache": {
            "l2": 6,
            "l3": 32
        },
        "integratedGraphics": {
            "model": "AMD Radeon Graphics"
        },
        "memory": {
            "max": 192,
            "types": ["DDR5"]
        },
        "multithreading": true,
        "pcieSupport": {
            "version": [5],
            "lanes": 28,
            "usable": 24
        },
        "lithography": "4nm"
    },
    "metadata": {
        "name": "AMD Ryzen 5 9600",
        "manufacturer": "AMD",
        "ecc": {
            "support": true,
            "needMotherboard": true
        },
        "tdp": {
            "base": 65,
            "max": 88
        },
        "microarchitecture": "Zen 5",
        "socket": "AM5"
    },
    "links": {
        "productPage": "https://www.amd.com/en/products/processors/desktops/ryzen/9000-series/amd-ryzen-5-9600.html",
        "sellers": [
            {
                "name": "Amazon",
                "url": "https://www.amazon.com/AMD-Ryzen-9600-3-8-5-2GHz/dp/B0DS65J9YW?crid=6U8PDADFKKDO&dib=eyJ2IjoiMSJ9.b5O4VTWHM8mHMxJ1WlARxUT0cYjZlFsgq7fgbrbXvURrsSw-VDGlsCy2bJ5o4BHZF2rWdEvoji7oRLqlCt61XDI2SYOwkm6gPoq8VDiBTK3pCuKHA-4DE8NC_99F1ELz4UlwFIQPHbAbJgSNC6v4qxLZaJihtJ9EZ29KqBVwik2QT4GLHZT8AyPw2GwQSfv3wjaKxk1-HEUFuvgnG2iQRhqx_fODxtD5NFUEU9utcDI.4DpfaU7dnhJUajXPH-Vdo4oA2ZUlhDA_1f3IjmRw5Cs&dib_tag=se&keywords=amd+ryzen+5+9600&qid=1768356665&sprefix=amd+ryzen+5+960%2Caps%2C436&sr=8-5&linkCode=ll1&tag=3dpc043-20&linkId=a4dc6dee10071eef8bf1c3fb699c8bc7&language=en_US&ref_=as_li_ss_tl"
         }
        ]
    }
}