{
    "id": "amd-ryzen-9800x3d",
    "specifications": {
        "cores": {
            "total": 8,
            "performance": 8,
            "efficient": null,
            "threads": 16
        },
        "clocks": {
            "performance": {
                "base": 4.7,
                "boost": 5.2
            }
        },
        "cache": {
            "l2": 8,
            "l3": 96
        },
        "integratedGraphics": {
            "model": "AMD Radeon Graphics"
        },
        "memory": {
            "max": 192,
            "types": ["DDR5"]
        },
        "multithreading": true,
        "pcieSupport": {
            "version": [5],
            "lanes": 28,
            "usable": 24
        },
        "lithography": "4nm"
    },
    "metadata": {
        "name": "AMD Ryzen 7 9800X3D",
        "manufacturer": "AMD",
        "ecc": {
            "support": true,
            "needMotherboard": true
        },
        "tdp": {
            "base": 120,
            "max": 162
        },
        "microarchitecture": "Zen 5",
        "socket": "AM5"
    },
    "links": {
        "productPage": "https://www.amd.com/en/products/processors/desktops/ryzen/9000-series/amd-ryzen-7-9800x3d.html",
        "sellers": [
            {
                "name": "Amazon",
                "url": "https://www.amazon.com/AMD-RyzenTM-9950X-32-Thread-Processor/dp/B0D6NNRBGP?crid=3UVB0FEQRWO3Q&dib=eyJ2IjoiMSJ9.FawL_EhH2eP6qYDmTHtWPBkMJtc_T4NB4jW_sXs3QTFbpa_GoHglkiF6qaS27ujnImYBEjsfokTsean-2nC5rba4Uc-Nw2vsmN7dV8B78N8dJ9dTz1rFwdcV5jA32NcL-KZVHS_cjrDh0mehloDhUj0h-vYgCNKgdmojWvbxs7VOXv7GsVerBHGWQlEsFW2JRd5mhEEpInxaozcSjfB1FM7oSCiAsSUSV6WBQ3HZkAI.3v2BY1yVBYdh6J5iUVC4f9l4hAW0YM28YhfOSDIsk8M&dib_tag=se&keywords=9950x&qid=1768096121&sprefix=9950x%2Caps%2C277&sr=8-1&linkCode=ll1&tag=3dpc043-20&linkId=5b4a4d6c490f447b19988ddf785728c3&language=en_US&ref_=as_li_ss_tl"
            }
        ],
        "images": {
        }
    }
}